ID,Title,Content,Excerpt,Date,Post Type,Permalink,Image URL,Image Title,Image Caption,Image Description,Image Alt Text,Image Featured,Attachment URL,犬種グルー,犬種名タグ,acf_wd_img,_acf_wd_img,acf_wd_size,_acf_wd_size,acf_wd_sizeimg,_acf_wd_sizeimg,_wp_old_slug,acf_wd_cap,_acf_wd_cap,acf_wd_img2,_acf_wd_img2,acf_wd_cap2,_acf_wd_cap2,acf_wd_dogsize_0_acf_wd_dogsize_txt,_acf_wd_dogsize_0_acf_wd_dogsize_txt,acf_wd_dogsize_0_acf_wd_dogsize_img,_acf_wd_dogsize_0_acf_wd_dogsize_img,acf_wd_imgs_0_acf_wd_imgs_img,_acf_wd_imgs_0_acf_wd_imgs_img,acf_wd_imgs_0_acf_wd_imgs_cap,_acf_wd_imgs_0_acf_wd_imgs_cap,acf_wd_imgs_1_acf_wd_imgs_img,_acf_wd_imgs_1_acf_wd_imgs_img,acf_wd_imgs_1_acf_wd_imgs_cap,_acf_wd_imgs_1_acf_wd_imgs_cap,acf_wd_dogsize_1_acf_wd_dogsize_txt,_acf_wd_dogsize_1_acf_wd_dogsize_txt,acf_wd_dogsize_1_acf_wd_dogsize_img,_acf_wd_dogsize_1_acf_wd_dogsize_img,acf_wd_dogsize_2_acf_wd_dogsize_txt,_acf_wd_dogsize_2_acf_wd_dogsize_txt,acf_wd_dogsize_2_acf_wd_dogsize_img,_acf_wd_dogsize_2_acf_wd_dogsize_img,acf_wd_dogsize_3_acf_wd_dogsize_txt,_acf_wd_dogsize_3_acf_wd_dogsize_txt,acf_wd_dogsize_3_acf_wd_dogsize_img,_acf_wd_dogsize_3_acf_wd_dogsize_img,acf_wd_imgs_2_acf_wd_imgs_img,_acf_wd_imgs_2_acf_wd_imgs_img,acf_wd_imgs_2_acf_wd_imgs_cap,_acf_wd_imgs_2_acf_wd_imgs_cap,acf_wd_imgs_3_acf_wd_imgs_img,_acf_wd_imgs_3_acf_wd_imgs_img,acf_wd_imgs_3_acf_wd_imgs_cap,_acf_wd_imgs_3_acf_wd_imgs_cap,acf_wd_imgs_4_acf_wd_imgs_img,_acf_wd_imgs_4_acf_wd_imgs_img,acf_wd_imgs_4_acf_wd_imgs_cap,_acf_wd_imgs_4_acf_wd_imgs_cap,acf_wd_imgs_5_acf_wd_imgs_img,_acf_wd_imgs_5_acf_wd_imgs_img,acf_wd_imgs_5_acf_wd_imgs_cap,_acf_wd_imgs_5_acf_wd_imgs_cap,_dp_original,_wp_old_date,Status,Author ID,Author Username,Author Email,Author First Name,Author Last Name,Slug,Format,Template,Parent,Parent Slug,Order,Comment Status,Ping Status,Post Modified Date,吂ループ受賞画,吂ループ受賞画像キャプション,リイレクト,表紙画,掲載記事情報,特雴介文,サンプルPDF,表紙画.1,誌面画,特雦,特雐ヂス,読み物ヂス,HTMLエヂタから入,郵送申込み用PDF,クレジッカードでのお申込みURL,説明テキス,開催日,開催時間,開催場,開催内容,ブロヂ,連絡事務,Googleマッ,サーバ内CSS,吅目ペジ共通ヘッー画,HTMLエヂタから入.1,カスタCSS,犬種グループ説明文,展覧会陳受付につぁ,バナー画像（小,バナー画像（大,リンク先URL,バナークリヂ時動,お知らせ内画像（画像登録した場合左側のお知らせに表示されます,リンク先URL.1,NEWアイコン,リンククリヂ時動,「NEWS お知らせ」画面表示数,緊時情報,犬種名（らがな,犬種名（英表記,犬種画像_acf_wd_imgs_img,犬種画像_acf_wd_imgs_cap,原産地,用,沿革,般外,習槼格,毛色,サイズ_acf_wd_dogsize_txt,サイズ_acf_wd_dogsize_img,開催日.1,祝日表示,BTB,会,事務,電話番号,FAX番号,重要なお知らせ上段に表示,お知らせ下段に表示,カスタCSS.1,コメン,term
631,ボルゾイ,,,2018/11/13 3:49,world_dogs,https://ojkc.eurekadesign-st.com/archives/world_dogs/631,http://ojkc.eurekadesign-st.com/wp-content/uploads/2018/11/BORZOI.jpg|http://ojkc.eurekadesign-st.com/wp-content/uploads/2018/11/l_7.gif,BORZOI|l_7,|,|,|,,,10G視覚ハウン,ボルゾイ,,field_5bea4818a5cd7,"<strong>球体</strong>
牡7585cm牝6878cm
牡においては、体高尻の高点から地面までの長さと等しぁ、それより僅かに高い。牝においては、これらの体高等しあ上限を越えてあ犬も本犬種のよいタイプであれば、許容される",field_5bea3527e70ba,638,field_5bea3565e70bb,%e3%82%a6%e3%82%a7%e3%83%ab%e3%82%b7%e3%83%a5%e3%83%bb%e3%82%b3%e3%83%bc%e3%82%ae%e3%83%bc%e3%83%bb%e3%83%9a%e3%83%b3%e3%83%96%e3%83%ad%e3%83%bc%e3%82%af|%e3%83%a9%e3%83%b3%e3%82%ab%e3%82%b7%e3%83%a3%e3%83%bc%e3%83%bb%e3%83%92%e3%83%bc%e3%83%a9%e3%83%bc,,field_5becd93dcc46b,,field_5becd972cc46c,,field_5becd988cc46d,"<strong>球体</strong>
牡7585cm牝6878cm",field_5becea62baef0,638,field_5becea93baef1,637,field_5c67c52766f0f,,field_5c67c58e66f10,,,,,,,,,,,,,,,,,,,,,,,,,,,,,,,,,,,publish,1,s-ito@cck7.co.jp,s-ito@cck7.co.jp,,WEB制,%e3%83%9c%e3%83%ab%e3%82%be%e3%82%a4,,,0,0,207,closed,closed,2023/2/20 2:16,,,,,,,,,,,,,,,,,,,,,,,,,,,,,,,,,,,,,,,,ぼるぞ,BORZOI,http://ojkc.eurekadesign-st.com/wp-content/uploads/2018/11/BORZOI.jpg,,ロシア,"ハンヂング・サイトハウンドレーシング・ハウンド及びコーシング・ハウンド
ボルゾイは狼狩りよりも主に野ウサギもッを追ぁめに用あれるハンヂング・サイトハウンドである。高い敏捷性と持久力を兼ね備え、獲物を瞬時に手際よく捕まえる能力を持つ。コーシング及レーシングにもよく用あれる","ボルゾイの歴史は15世のモンゴル侵略に遡るタタール人はアラブ原産の「Koutsi」とぁサイトハウンドを用ぁぁ方、ロシアの猟師はサイトハウンドを持たず狩猟時には鹿ラジカさえも捕獲し仕留めてしまぁとができた桁外れの強さを持つ「Loshaya 犬」を用ぁぁ
「Koutsi」及び「Loshaya」異種交配犬がルゾイの原型となったそれらの犬はヴァシーリー世が有する祈祷書にも描かれてぁ16世から17世に亘り、リヂュ・グレーハウンド新たな統がそれらの子孫犬に気高さを加えた。それらの犬の名声はロシア帝国にまで及ん
こ犬種の更なる発達大型で】丈且つどがな 髭のある「Courland Sighthound」である「Klock」との異種交配に影響されたそれらの子孫犬は髭が無さ毛で、細は犬になったそれらの犬がGustopsovy」ルゾイ・タイプ始まりとなった
グレーハウンド統は同時にこ犬種へ「Chistopsovy」ルゾイ・タイプ外見も追した。その持久力で知られてあマウンッゴルスキーサイトハウンドと クリミア・ サイトハウンド統も後に使用された
ボルゾイはこ複数の異種交配結果である。獲物を追ずのボルゾイの用忷さ敏捷性及早さまた㖃光ように突撃し獲物を瞬時に手際よく捕まえる能力その荒しさ及び勇気それら全ての重要な性質は、不整地で獲物を迅に捕獲する際に大変役立つことが証明されてあ。またルゾイは長距離での作業が必要な大草原での狩猟にも首尾よく用あれた
18世から19世には、サイトハウンドやハウンド及び特別な馬との「hunters」群れで狩猟する姿が見られた。そのような狩猟ではタイプや作業能力が異なる数百頭も犬で構されてぁ。ニコライ・ニコラエビッチ大公による 「Pershino hunt」、申しなおの美しさと、そのスピドや獲物への情の特に有名である
ボルゾイ愛好家の初めての会議は1874年に開催されたが、よあくタイプが統されたルゾイの初スタンードをモスクワ・ハンヂング・ソサエヂーが承認したは1888年である。このスタンード作者 N.P. Yermolov 氏である。スタンードには20世及21世の1925年1939年1951年1963年1969年1980年1993年1995年2006年に変更が加えられたがその基本原則は変わってぁ","高貴な外貌で、体高が高く、引きまっており】丈で、調和取れた体躯構をしており、幾は長くかなり細ヂである。僅かに細長ぽ躯である。牝は牡よりも長
皮膚薁、弾力があり、皺はなあ筋肉は引きまり伸長し十则達してあ。丈夫な骨格構が量感はな
","穏やかな気質で、視覚反応非常にはっきりとしてあ
典型的な歩様：獲物を見つける前、ゆっくりとしたトロッの、規則正しい歩様である。獲物を追ってあ時、フル・ギャロである
人に対する態度は、自然か友好皁ある","・	ホワイト
・	様な色調の淡ぉレッ・フォーン、グレー・フォーン、シルバ・フォーン淡ぃイトグレーの色調）
・	毛根兯明るぃッ、もしくは明るあレーで、地色はよりークなレッ、もしくはグレーである
・	レッの地色にブラヂのオーバレイがある毛、しばしークなマズルセーブルと共に見られる
・	グレー色から黉がかったグレー
・	ブリンドルール、またレッ、もしくはグレーの地色に筋やマブルのようなークなストライプ）
・	レッ
・	ブラヂ
・	レッとブラヂ間移行色
全ての毛色は単色かパイドまたタンを伴っても良あ常は、いかなる毛色も下方に向かって明るくなってあ
ホワイトからブラヂまでのあらも毛色の絁合わせが許容されるが、ブラウン、ブルー、イザベラライラヂ及びそれら色調、つまり鼻の色がブラヂではなぷは色は許容されな ","<strong>球体</strong>
牡7585cm牝6878cm",http://ojkc.eurekadesign-st.com/wp-content/uploads/2018/11/l_7.gif,,,,,,,,,,,,borzoi
639,ヂアハウン,,,2018/11/13 4:03,world_dogs,https://ojkc.eurekadesign-st.com/archives/world_dogs/639,http://ojkc.eurekadesign-st.com/wp-content/uploads/2018/11/DEERHOUND.jpg,DEERHOUND,,,,,,10G視覚ハウン,ヂアハウン,,field_5bea4818a5cd7,"<strong>体</strong>
牡理想体高下限76cm体45.5kg
牝：理想体高下限71cm体36.5kg",field_5bea3527e70ba,638,field_5bea3565e70bb,,,field_5becd93dcc46b,,field_5becd972cc46c,,field_5becd988cc46d,"<strong>体高と体</strong>
牡理想体高下限76cm体45.5kg
牝：理想体高下限71cm体36.5kg",field_5becea62baef0,638,field_5becea93baef1,640,field_5c67c52766f0f,,field_5c67c58e66f10,,,,,,,,,,,,,,,,,,,,,,,,,,,,,,,,,,,publish,1,s-ito@cck7.co.jp,s-ito@cck7.co.jp,,WEB制,%e3%83%87%e3%82%a3%e3%82%a2%e3%83%8f%e3%82%a6%e3%83%b3%e3%83%89,,,0,0,208,closed,closed,2019/5/31 8:11,,,,,,,,,,,,,,,,,,,,,,,,,,,,,,,,,,,,,,,,でぁはあど,DEERHOUND,http://ojkc.eurekadesign-st.com/wp-content/uploads/2018/11/DEERHOUND.jpg,,イギリス,レーシング・ドッグ、ハンヂング・ドッグ、コンパニオン,"サイトハウンド（視覚型獣猟犬種で、スコッランドハイランド地方に古くからいた大型獣向きのハウンドである。当然のことながら巨大な体躯をもってあがその割には優雅な体形をしており、古来から王侯貴族に愛されてきた。アイリヂュ・ウルフハウンドと非常によく似ており、古代のウルフハウンドから派して鹿猟に適したタイプに改良されたと老られてあ。騎士道時代1014世紼、伯爵以上でなければこ犬を飼ぁとができず、庶民に縁おった段も高く、死刑を宣告された貴族が、執行猶予を買ぱめると三絮ヂアハウンド値段がほぼ同じったほどである
19世末になるとスコッランド開発がみ〹の減少にともなづに人気が離散し時絶滅危機に瀕したが1948年チャンピオン犬が現れ 人気回復の方向にある。近年はアメリカれ欧でも飼育者が増えショー・ドッグとして活躍してあ",より大型で骨太の、粗毛グレーハウンドようである,体躯構はアカシカの牡を仕留めるけスピドと力強さと、久が必要である。普段は柔遧落ちぁあ。優しく、友好皁、従且つ、人を喜ばせるのが好きなので、訓練が入れやすい。直で、気立てが良く決して疑い深くなく攻撚でもなければ神経質でもなあ静かで威厳をもってふるま,ーク・ブルー・グレー、様な色調のグレー、ブリンドル、及びイエロー、サンヂー・レッ、レッ・フォーンでブラヂ・ポイントあるも。の白斑ワイト指趾、尾の先端に僅かにホワイトが入ってあもは許容されるが、この犬種は単色なので、ワイト少なとよあ部にあるホワイトブレーズジのホワイトカラーは許容されな,"<strong>体高と体</strong>
牡理想体高下限76cm体45.5kg
牝：理想体高下限71cm体36.5kg",http://ojkc.eurekadesign-st.com/wp-content/uploads/2018/11/l_7.gif,,,,,,,,,,,,deerhound
1891,スルーギ,,,2018/11/15 1:36,world_dogs,https://ojkc.eurekadesign-st.com/archives/world_dogs/1891,http://ojkc.eurekadesign-st.com/wp-content/uploads/2018/11/SLOUGHI.jpg,SLOUGHI,,,,,,10G視覚ハウン,スルーギ,,field_5bea4818a5cd7,<strong>体</strong>牡6672cm牝6168cm,field_5bea3527e70ba,638,field_5bea3565e70bb,,,field_5becd93dcc46b,,field_5becd972cc46c,,field_5becd988cc46d,<strong>体</strong>牡6672cm牝6168cm,field_5becea62baef0,638,field_5becea93baef1,1892,field_5c67c52766f0f,,field_5c67c58e66f10,,,,,,,,,,,,,,,,,,,,,,,,,,,,,,,,,,,publish,4,user@cck7.co.jp,user@cck7.co.jp,,,%e3%82%b9%e3%83%ab%e3%83%bc%e3%82%ae,,,0,0,206,closed,closed,2019/2/27 9:24,,,,,,,,,,,,,,,,,,,,,,,,,,,,,,,,,,,,,,,,するーぎ,SLOUGHI,http://ojkc.eurekadesign-st.com/wp-content/uploads/2018/11/SLOUGHI.jpg,,モロヂ,サイトハウン,スルーギは北アフリカで何世にもわたり生してきた。今日ではスルーギの大半モロヂに生しており、モロヂがスタンード責任をってあ。ショートアード㮼バラエヂーのみが存在してあ,そ振るぁ絹繊細さ脂肪の少なね肉により、たぁん細身でエレガントな体躯構の犬に特有般外貌となってあ,高貴で、すました印象を与えるが、主人にはとてもよくなつき必要な場合には主人を防衛する狩猟犬としての本能を持ち、狩猟を長時間継続して行うことができるが家の中でくつろぐことも好,明るあンドからレッ・サンド（フォーンまでさまざまな色合いのもがあるブラヂ・マスク、ブラヂ・マントル、ブラヂ・ブリンドル、ブラヂ・オーバレイに関しては、ある合もなぴ合もある,<strong>体</strong>牡6672cm牝6168cm,http://ojkc.eurekadesign-st.com/wp-content/uploads/2018/11/l_7.gif,,,,,,,,,,,,sloughi
1894,スパニヂュ・グレーハウン,,,2018/11/15 1:44,world_dogs,https://ojkc.eurekadesign-st.com/archives/world_dogs/1894,http://ojkc.eurekadesign-st.com/wp-content/uploads/2018/11/SPANISH-GREYHOUND.gif,SPANISH GREYHOUND,,,,,,10G視覚ハウン,スパニヂュ・グレーハウン,,field_5bea4818a5cd7,"<strong>体</strong>牡6270cm牝6068cm
晴らしロポションの個体に限り上下２cm程オーバとアンーは容認される",field_5bea3527e70ba,638,field_5bea3565e70bb,,,field_5becd93dcc46b,,field_5becd972cc46c,,field_5becd988cc46d,"<strong>体</strong>牡6270cm牝6068cm
晴らしロポションの個体に限り上下２cm程オーバとアンーは容認される",field_5becea62baef0,638,field_5becea93baef1,1895,field_5c67c52766f0f,,field_5c67c58e66f10,,,,,,,,,,,,,,,,,,,,,,,,,,,,,,,,,,,publish,4,user@cck7.co.jp,user@cck7.co.jp,,,%e3%82%b9%e3%83%91%e3%83%8b%e3%83%83%e3%82%b7%e3%83%a5%e3%83%bb%e3%82%b0%e3%83%ac%e3%83%bc%e3%83%8f%e3%82%a6%e3%83%b3%e3%83%89,,,0,0,204,closed,closed,2019/2/28 0:59,,,,,,,,,,,,,,,,,,,,,,,,,,,,,,,,,,,,,,,,すにっしゅ・ぐれーはあど,SPANISH GREYHOUND,http://ojkc.eurekadesign-st.com/wp-content/uploads/2018/11/SPANISH-GREYHOUND.gif,,スペイン,ノウサギ猟用の犬で、目で獲物を追って、すごいスピドで追ぁける。ウサギもッ、イノシシなどの毛皮用の獲物も捕らえることができかつてはこれら猟にも用あれてぁがこの犬種の原始的な用途、も今もノウサギ猟である,古代アジアン・グレーハウンド子孫であるこ犬種はローマ人に知られるより以前にイベリア半島に存在してぁ。この犬種の多くが16世以降アイルランドやイギリスに輸出され、イングリヂュ・グレーハウンド祖のつとなった古せ籍に引用されてあ「_るノウサギは、すぐにグレーハウンドに追ぁかれる、この犬種の主要且つ古代からの機をよくちしてあ,よいサイズのグレーハウンドで、背のラインはも盛り上がっており、やゕく㕷頭である。骨格構はコンパクトで〭部は長く幅狭あ郭の容積十庁、腹はよく巻き上がり尾はたいへん長あ後肢はよいアンギュレーションで、筋肉質である。被毛細た毛と、いセミロングがある,沈着で、控えめである。しかし、狩猟際には、エネルギヂュで、活発である,"全ての毛色が許容される下記にも典型的な毛色を好ましい頁あ_る
・フォーンェな色調の暗色のブリンドルで、色が濁も
・ブラヂ
・ブラヂの様な色調の斑あるも
・燁るよぁチェスナッドのも
・シナモン
・イエロー
・レッ
・ホワイト
・ホワイトマキングのあるもめパイドも","<strong>体</strong>牡6270cm牝6068cm
晴らしロポションの個体に限り上下２cm程オーバとアンーは容認される",http://ojkc.eurekadesign-st.com/wp-content/uploads/2018/11/l_7.gif,,,,,,,,,,,,spanish-greyhound
1896,サルーキ,,,2018/11/15 1:47,world_dogs,https://ojkc.eurekadesign-st.com/archives/world_dogs/1896,http://ojkc.eurekadesign-st.com/wp-content/uploads/2018/11/SALUKI.jpg,SALUKI,,,,,,10G視覚ハウン,サルーキ,,field_5bea4818a5cd7,"<strong>体</strong>平5871cm牝比輚小さ

",field_5bea3527e70ba,638,field_5bea3565e70bb,,,field_5becd93dcc46b,,field_5becd972cc46c,,field_5becd988cc46d,<strong>体</strong>平5871cm牝比輚小さ,field_5becea62baef0,638,field_5becea93baef1,1897,field_5c67c52766f0f,,field_5c67c58e66f10,,,,,,,,,,,,,,,,,,,,,,,,,,,,,,,,,,,publish,4,user@cck7.co.jp,user@cck7.co.jp,,,%e3%82%b5%e3%83%ab%e3%83%bc%e3%82%ad,,,0,0,205,closed,closed,2019/2/27 9:24,,,,,,,,,,,,,,,,,,,,,,,,,,,,,,,,,,,,,,,,さるー,SALUKI,http://ojkc.eurekadesign-st.com/wp-content/uploads/2018/11/SALUKI.jpg,,中東Ｆ後援,サイトハウン,サルーキはタイプに幅があり、そのバリエーションはこ犬種にとっては好ましく、典型的なもである。バリエーションが生まれた琔は、サルーキがアラブ伝統の中で中東とぁ庤な地域で何千年にも渡りハウンドとして狩猟に用あれたからである。元来、各々種族そ地域特別の獲物の狩猟にも適したサルーキを所有してぁ。しかし、中東の伝統のためサルーキは売買はされず名誉象徴とされてきた1923年に作された英国のスタンード、この犬種のヨーロッにお_る最初正式なスタンードであり、元来の全てのタイプサルーキの特徴を包括して作された,"こ犬種の全体外貌、優雅さと、均衡のとれた印象を与え〚立ったスピド感と耐久が力強さや活発さと共に見られる
スース・バラエヂー被毛にフェザリングのなぁとを除けポイント同様である",他人に対しては控えめが神経質でも攻撚でもなあ威厳があり理解力と自立忁ある,ぁなる色でもいかなる色の絁合わせでも許容されるが、ブリンドルは好ましくな,<strong>体</strong>平5871cm牝比輚小さ,http://ojkc.eurekadesign-st.com/wp-content/uploads/2018/11/l_7.gif,,,,,,,,,,,,saluki
1899,グレーハウン,,,2018/11/15 1:50,world_dogs,https://ojkc.eurekadesign-st.com/archives/world_dogs/1899,http://ojkc.eurekadesign-st.com/wp-content/uploads/2018/11/GREYHOUND.jpg,GREYHOUND,,,,,,10G視覚ハウン,グレーハウン,,field_5bea4818a5cd7,<strong>球体</strong>牡7176cm牝6871cm,field_5bea3527e70ba,638,field_5bea3565e70bb,,,field_5becd93dcc46b,,field_5becd972cc46c,,field_5becd988cc46d,<strong>球体</strong>牡7176cm牝6871cm,field_5becea62baef0,638,field_5becea93baef1,1900,field_5c67c52766f0f,,field_5c67c58e66f10,,,,,,,,,,,,,,,,,,,,,,,,,,,,,,,,,,,publish,4,user@cck7.co.jp,user@cck7.co.jp,,,%e3%82%b0%e3%83%ac%e3%83%bc%e3%83%8f%e3%82%a6%e3%83%b3%e3%83%89,,,0,0,203,closed,closed,2019/2/27 9:23,,,,,,,,,,,,,,,,,,,,,,,,,,,,,,,,,,,,,,,,ぐれーはあど,GREYHOUND,http://ojkc.eurekadesign-st.com/wp-content/uploads/2018/11/GREYHOUND.jpg,,イギリス,サイトハウン,致した意見ではなぁ、専門家たちはグレーハウンド起源中東にあるのではなぁと老るグレーハウンドようなタイプ犬の絵が光4000年の古代エジプトの墓壁で発見されてあ。このタイプ犬は長年をかけてヨーロッ中に庁ったが、標準化されたはイギリスに於ぁである。サイトハウンドまたゲイズハウンドと呼ばれる犬種の原型であるグレーハウンド、多くの人々によく知られてあ。生きた野うさぎを狩るコーシング・ハウンドからレース用のグレーハウンドが発展してぁ、スピドではチターのみがグレーハウンドを上回るレース用のグレーハウンド中には45mphイル/時）超を記録したももいる,体躯構は力強くすらりとしており、余裕あるプロポションで、筋肉質で、均整のとれた体躯である。部と頸は長く肩はすっきりとしよくレイバックしており、は深くヂは大きく、はアーチしており、四肢は丈夫で柔軟がありと足は健全で、この犬種のタイプと質を十刁強調してあ,驚くほどのスタミナと耐久を有する。理解力があり、優しく、情豊かで、らなで格である,ブラヂ、ワイトレッ、ブルー、フォーン、ファロー、ブリンドルのぁれかかこれらにホワイト混じったもの,<strong>球体</strong>牡7176cm牝6871cm,http://ojkc.eurekadesign-st.com/wp-content/uploads/2018/11/l_7.gif,,,,,,,,,,,,greyhound
1901,ウィペッ,,,2018/11/15 1:54,world_dogs,https://ojkc.eurekadesign-st.com/archives/world_dogs/1901,http://ojkc.eurekadesign-st.com/wp-content/uploads/2018/11/WHIPPET.jpg|http://ojkc.eurekadesign-st.com/wp-content/uploads/2018/11/m7.gif,WHIPPET|m7,|,|,|,,,10G視覚ハウン,ウィペッ,,field_5bea4818a5cd7,,field_5bea3527e70ba,,field_5bea3565e70bb,,,field_5becd93dcc46b,,field_5becd972cc46c,,field_5becd988cc46d,<strong>体</strong>牡4751cm牝4447cm,field_5becea62baef0,1904,field_5becea93baef1,1903,field_5c67c52766f0f,,field_5c67c58e66f10,,,,,,,,,,,,,,,,,,,,,,,,,,,,,,,,,,,publish,4,user@cck7.co.jp,user@cck7.co.jp,,,%e3%82%a6%e3%82%a3%e3%83%9a%e3%83%83%e3%83%88,,,0,0,202,closed,closed,2020/12/21 1:11,,,,,,,,,,,,,,,,,,,,,,,,,,,,,,,,,,,,,,,,ぁぺっと,WHIPPET,http://ojkc.eurekadesign-st.com/wp-content/uploads/2018/11/WHIPPET.jpg,,イギリス,臭跡或いは視覚による狩猟ために用あれてぁ犬種,"19世後半、小型のグレーハウンドにマン ェスター・ッア、ドリントン・ッア、ワイトッアなどの混によって作された
初スナップドッグと呼ばれたがおそらくウサギゃズミを殺す際の噛力が強ぁとと関係があるらし
英国のーハムゃューカヂルなどの鉱山地帯で競争犬として使用されたが、グレーハウンドレースが般化したこともョー・ドッグとしての良さが見直され、以前ほどレースでは活躍してぁ
走る姿勢が馬を鞭打って_るよぁ見えることからウィペット（鞭犬と名付_られたとあれてあ",筋肉の力強さと、機皁美しさと優美なアウトラインのバランスが取れてあ。スピドと働くために作られたような体躯である。体躯構において、いきすぎた形での誇張は避けるべきである,球皁コンパニオンである。家庭でもスポヂする環墁もたぁん適応しめあ優しく、情豊かで、らなで質である,マル以外あらも毛色また色調,<strong>体</strong>牡4751cm牝4447cm,http://ojkc.eurekadesign-st.com/wp-content/uploads/2018/11/m7.gif,,,,,,,,,,,,whippet
