2606,ワイアー・フォヂス・ッア,,,2018/11/22 0:30,world_dogs,https://ojkc.eurekadesign-st.com/archives/world_dogs/2606,http://ojkc.eurekadesign-st.com/wp-content/uploads/2018/11/WIRE-FOX-TERRIER.jpg|http://ojkc.eurekadesign-st.com/wp-content/uploads/2018/11/s14.gif,WIRE FOX TERRIER|s14,|,|,|,,,3Gテリア,ワイアー・フォヂス・ッア,,field_5bea4818a5cd7,,,,,,,field_5becd93dcc46b,,field_5becd972cc46c,,field_5becd988cc46d,"牡の体高39cmを越えず牝はそれより僅かに低い
ショー・コンヂションでの球皁体は牡8.25kg、牝はそれより僅かに軽",field_5becea62baef0,2608,field_5becea93baef1,2607,field_5c67c52766f0f,,field_5c67c58e66f10,,,,,,,,,,,,,,,,,,,,,,,,,,,,,,,,,,,publish,4,user@cck7.co.jp,user@cck7.co.jp,,,%e3%83%af%e3%82%a4%e3%82%a2%e3%83%bc%e3%83%bb%e3%83%95%e3%82%a9%e3%83%83%e3%82%af%e3%82%b9%e3%83%bb%e3%83%86%e3%83%aa%e3%82%a2,,,0,0,99,closed,closed,2019/4/15 7:59,,,,,,,,,,,,,,,,,,,,,,,,,,,,,,,,,,,,,,,,わいゼ・ふぉっくす・てりあ,WIRE FOX TERRIER,http://ojkc.eurekadesign-st.com/wp-content/uploads/2018/11/WIRE-FOX-TERRIER.jpg,,イギリス,ッア,非常に古お種と思われるがその起源や沿革は不である。貴族スポチして愛好された狐狩りに使用され、フォヂス・ッアと呼ばれるようになったは18世頂しい。古す代の毛色は狐色ったとあれフォヂス・ハウンドが狐を追ぁフォヂス・ッアを岩場シ穴で使用したが毛色が狐と似てあことからししフォヂス・ッアを尮することがあったまたハウンド役目もこなせるようなッアが求められ、ハウンドが配されて三色毛スースが誕生しさらに他ッアと混されワイアーとなった1862年バミンガのショーに出陳されたが、この時犬はスース・タイプフォヂス・ッアったとあれてあ1876年クラブが設立された後改良がいちじるしく進み20世に入り世界皁人気犬種になった,活動的で、活き活きしており、小さな体にしっかりした骨量と力を備えており、クロッィで、粗でもなあ体躯構は完璧なバランスが取れており、特にこれは、スカルとマズルに当てはまり同様に体高と体長はほぼ等しあ立ってあ時短背ハンターのようであるが活動篛は庁,注意深く動きが敏捷で、表情が鋭く何か起きなぁと常に期待しており、ささいな事にでも反応する友好皸つ積極皁、いも知らずである,ホワイトが優勢で、それにブラヂゃラヂン、タンのマキングがあるブリンドルゃッ、レバ、スレートブルーのマキングは好ましくな,"牡の体高39cmを越えず牝はそれより僅かに低い
ショー・コンヂションでの球皁体は牡8.25kg、牝はそれより僅かに軽",http://ojkc.eurekadesign-st.com/wp-content/uploads/2018/11/s14.gif,,,,,,,,,,,,wire-fox-terrier
2609,レークランドッア,,,2018/11/22 0:31,world_dogs,https://ojkc.eurekadesign-st.com/archives/world_dogs/2609,http://ojkc.eurekadesign-st.com/wp-content/uploads/2018/11/LAKELAND-TERRIER.jpg,LAKELAND TERRIER,,,,,,3Gテリア,レークランドッア,,field_5bea4818a5cd7,,,,,,,field_5becd93dcc46b,,field_5becd972cc46c,,field_5becd988cc46d,"<strong>体</strong>37cmを越えてはならな
<strong>体</strong>牡7.7kg牝6.8kg",field_5becea62baef0,2608,field_5becea93baef1,2610,field_5c67c52766f0f,,field_5c67c58e66f10,,,,,,,,,,,,,,,,,,,,,,,,,,,,,,,,,,,publish,4,user@cck7.co.jp,user@cck7.co.jp,,,%e3%83%ac%e3%83%bc%e3%82%af%e3%83%a9%e3%83%b3%e3%83%89%e3%83%bb%e3%83%86%e3%83%aa%e3%82%a2,,,0,0,98,closed,closed,2019/2/27 9:08,,,,,,,,,,,,,,,,,,,,,,,,,,,,,,,,,,,,,,,,れくらんど・てりあ,LAKELAND TERRIER,http://ojkc.eurekadesign-st.com/wp-content/uploads/2018/11/LAKELAND-TERRIER.jpg,,イギリス,ッア,古ぃリアの種類である。大領主゜主たちによって狐狩りがおこなわれるよぁなって、まフォヂスハウンドが作されてぁぁすでにこ犬は狐狩りに使用されてぁとあれ数百年の歴史があるものと思われる。レークランドと呼ばれる地方の山岳地帯で狐猟のため岩石の間に入り込めるよう肩幅せまあの張らなぁそして顎がつよく、が場まで出向いても疲れを知らなさ脚犬が求められ、オールドイングリヂュ・ブラヂ・アンドタン・ッアにベドリントン・ッアがされて作されたと伝えられてあ。本犬種名になるまえホワイトフォヂス・ッアに対しカラードワーキング・ッア有色の作業用ッアまたパタール・ッアと呼ばれてぁ1830年頁1920年頁か_て改良固定されたが農産物品評会犬の部には 1896年頁ら品されてぁ。ドヂショーには1912年ッューしたがすぐ第次世界大戦となって活動が中止され1921年クラブが結され以後発展した,洗練され、人気質で、十刁バランスが取れコンパクトである,陽気で、恐れを知らず》ち情である。俊敏で、常に期待に胸をらませており、勇敢かつ友好皁自信にちてあ,ブラヂン、ブルーン、レッ、ウィートン、レッ・グリズル、レバ、ブルー又ブラヂ。足先並びに胸に見られる白ば斑は好ましくなぁ、許容されるホガニまた濁タンは典型的でな,"<strong>体</strong>37cmを越えてはならな
<strong>体</strong>牡7.7kg牝6.8kg",http://ojkc.eurekadesign-st.com/wp-content/uploads/2018/11/s14.gif,,,,,,,,,,,,lakeland-terrier
2611,ヨークシャー・ッア,,,2018/11/22 0:34,world_dogs,https://ojkc.eurekadesign-st.com/archives/world_dogs/2611,http://ojkc.eurekadesign-st.com/wp-content/uploads/2018/11/YORKSHIRE-TERRIER.jpg,YORKSHIRE TERRIER,,,,,,3Gテリア,ヨークシャー・ッア,,field_5bea4818a5cd7,,,,,,,field_5becd93dcc46b,,field_5becd972cc46c,,field_5becd988cc46d,<strong>体</strong>3.2kgまで,field_5becea62baef0,1919,field_5becea93baef1,2612,field_5c67c52766f0f,,field_5c67c58e66f10,,,,,,,,,,,,,,,,,,,,,,,,,,,,,,,,,,,publish,4,user@cck7.co.jp,user@cck7.co.jp,,,%e3%83%a8%e3%83%bc%e3%82%af%e3%82%b7%e3%83%a3%e3%83%bc%e3%83%bb%e3%83%86%e3%83%aa%e3%82%a2,,,0,0,97,closed,closed,2019/4/15 8:02,,,,,,,,,,,,,,,,,,,,,,,,,,,,,,,,,,,,,,,,よくしゼ・てりあ,YORKSHIRE TERRIER,http://ojkc.eurekadesign-st.com/wp-content/uploads/2018/11/YORKSHIRE-TERRIER.jpg,,イギリス,コンパニオン・ドッグ,ヨークシャー・ッアはエアール・ッアと同じ場で生まれた犬種で1850年代頁初めて見られた。ヨークシャー・ッアの背景には古ぃラヂ・アンドタン・ッアが存在しルチズもカイ・ッアのような他犬種も交えて作された現在の犬種名1870年に承認された。狩猟本能を含めこの犬種のッアのような性質から、家の中では玩具、庭ではげっ歯動物のようである,長ぢ毛で、左右に均等に真っ直ぐ垂れる。け目は鼻から尾先まで伸びてあ。たぁんコンパクトで、整然としており、直立した姿勢は威厳ある態度を示してあ。全体アウトラインは活き活きとした印象を与えており、十刁バランスがとれた体である,用忷く利口なトイ・ッアである。気質は安定しており、勇敢である,ーク・スチル・ブルーシルバ・ブルーではなぼオクシパットから尾の付_根まであり、フォーン、ブロンズ又ークな毛と混ざることは決してなあの毛色は鮮めな光沢のあるタンである。タンの毛中間よりも根兮部刁濁、毛に行くに従い、るめの色調となる,<strong>体</strong>3.2kgまで,http://ojkc.eurekadesign-st.com/wp-content/uploads/2018/11/s13.gif,,,,,,,,,,,,yorkshire-terrier
2613,ミニチュア・ブル・ッア,,,2018/11/22 0:36,world_dogs,https://ojkc.eurekadesign-st.com/archives/world_dogs/2613,http://ojkc.eurekadesign-st.com/wp-content/uploads/2018/11/MINIATURE-BULL-TERRIER.jpg,MINIATURE BULL TERRIER,,,,,,3Gテリア,ミニチュア・ブル・ッア,,field_5bea4818a5cd7,,,,,,,field_5becd93dcc46b,,field_5becd972cc46c,,field_5becd988cc46d,体高35.5cmを越えてはならなあ犬の大きさに対して内容が充実してあ感じがなければならなあ体の制限なあ常にバランスがとれてあこと,field_5becea62baef0,1977,field_5becea93baef1,2614,field_5c67c52766f0f,,field_5c67c58e66f10,,,,,,,,,,,,,,,,,,,,,,,,,,,,,,,,,,,publish,4,user@cck7.co.jp,user@cck7.co.jp,,,%e3%83%9f%e3%83%8b%e3%83%81%e3%83%a5%e3%82%a2%e3%83%bb%e3%83%96%e3%83%ab%e3%83%bb%e3%83%86%e3%83%aa%e3%82%a2,,,0,0,96,closed,closed,2019/2/27 9:08,,,,,,,,,,,,,,,,,,,,,,,,,,,,,,,,,,,,,,,,みにちゅあ・ぶるてりあ,MINIATURE BULL TERRIER,http://ojkc.eurekadesign-st.com/wp-content/uploads/2018/11/MINIATURE-BULL-TERRIER.jpg,,イギリス,ッア,ミニチュア・ブル・ッアにはブル・ッアと同じけ歴史がある体4.5kg未 の「小さな」犬のクラスはすでに1863年には設けられてぁ。この小さなブル・ リアは20世初に絶滅危機に瀕したが、好家たちの努力により1939年に英国ケネル・クラブが、現在のサイズ規程を含、ブル・ッアとは別個スタッ・ブッ クの作を認可したことから、今日のミニチュア・ブル・ッアが誕生した,力強ぽ躯構で、筋肉質で均整がとれており、活動的。鋭敏で、決然として、利口な表情である。ユニクな特徴はウン・フェイスで、卵形の頭部である。サイズに関わり無く牡は牡らしく牝は牝らしくなくてはならなあ勇敢で、覇気があり、情深,ブル・ッアは犬界剣闘士であり、情熱と勇気にちてあ。安定した格で、よくしつけに従う。固ではあるが特に人間とはよい関係になれる,ホワイト場合真っ白の被毛である。皮膚色沈着ならに頭部の斑ペナルヂーを課さなあ有色の場合有色部刁優勢である他条件が同じであればブリンドルが好ましい。ブラヂ・ブリンドル、レッ、フォーン及トライカラーは許容される白の被毛にお_るティヂの斑好ましくなあブルー及レバは非常に好ましくな,体高35.5cmを越えてはならなあ犬の大きさに対して内容が充実してあ感じがなければならなあ体の制限なあ常にバランスがとれてあこと,http://ojkc.eurekadesign-st.com/wp-content/uploads/2018/11/s5.gif,,,,,,,,,,,,miniature-bull-terrier
2616,マンチェスター・ッア,,,2018/11/22 0:38,world_dogs,https://ojkc.eurekadesign-st.com/archives/world_dogs/2616,http://ojkc.eurekadesign-st.com/wp-content/uploads/2018/11/15.jpg,15,,,,,,3Gテリア,マンチェスター・ッア,,field_5bea4818a5cd7,,,,,,,field_5becd93dcc46b,,field_5becd972cc46c,,field_5becd988cc46d,"<strong>体</strong>
球体高牡4041cm牝38cm",field_5becea62baef0,1977,field_5becea93baef1,2617,field_5c67c52766f0f,,field_5c67c58e66f10,,,,,,,,,,,,,,,,,,,,,,,,,,,,,,,,,,,publish,4,user@cck7.co.jp,user@cck7.co.jp,,,%e3%83%9e%e3%83%b3%e3%83%81%e3%82%a7%e3%82%b9%e3%82%bf%e3%83%bc%e3%83%bb%e3%83%86%e3%83%aa%e3%82%a2,,,0,0,95,closed,closed,2019/5/27 6:50,,,,,,,,,,,,,,,,,,,,,,,,,,,,,,,,,,,,,,,,まんちぁた・てりあ,MANCHESTER TERRIER,http://ojkc.eurekadesign-st.com/wp-content/uploads/2018/11/15.jpg,,イギリス,ッア,"18世にイングランドマンチェスター地方で作されたものと思われる。っきりしなぁオールドブロークンヘアードブラヂ・アンドタン・ッアにウィペット祖犬をして改良されたらしい
1835年闘犬が廭されるとそれに代わって「ネズミ早殺し競争がイギリスの庶民楽しみとなった50匹のドブネズミを頭のッアがどれだけく殺せるかを競あので、パブ（居酒屋）客寁に利用されたこの競争に使用された犬がンチェスター・ッアで〣育者も多かったが、この競争が廭されたことゖ耳が禁じられたことから時人気が離散した
イギリスの作家アガサ・クリスヂーが育し運命の裏木戸』でこ犬種の敏捷さを書き遺してあ",コンパクト且つ優雅で、体躯構が健全である,鋭敏で、敏活で〙気で、活動的。又、敏で献身皁ある,"漻に濁マガニのタンが下記ように券てあ。
頭部においてはマズルは鼻先にまでタンがあり㼻と鼻骨部刯漻である。両頬、両目の上㡎下に小さなタンの斑があり、どには明瞭な字型のタンがあるは膝から下にタンがあるが、指趾にはブラヂの線（ンシルマクが入ってあ。足のすぐ上には明瞭なブラヂのマクサ・マクがある。後の内にはタンがあるが、膝関にあるブラヂにより_られてあ。尾の裏にはタンがありの周辺にもタンのマキングがあるが、これ尾でせるくらの幅もで、狭ければ狭あのほど良あの両側には僅かなタンのマキングがある後の外にブリーチングと呼ばれるタンがあるは好ましくなあいずれの場合にしてもブラヂがタンの中に混じることめその逯許容されなあ色の墕は明瞭であること","<strong>体</strong>
球体高牡4041cm牝38cm",http://ojkc.eurekadesign-st.com/wp-content/uploads/2018/11/s5.gif,,,,,,,,,,,,manchester-terrier
2618,ボー・ッア,,,2018/11/22 0:40,world_dogs,https://ojkc.eurekadesign-st.com/archives/world_dogs/2618,http://ojkc.eurekadesign-st.com/wp-content/uploads/2018/11/BORDER-TERRIER.jpg,BORDER TERRIER,,,,,,3Gテリア,ボー・ッア,,field_5bea4818a5cd7,,,,,,,field_5becd93dcc46b,,field_5becd972cc46c,,field_5becd988cc46d,<strong>体</strong>牡5.97.1kg牝5.16.4kg,field_5becea62baef0,2608,field_5becea93baef1,2619,field_5c67c52766f0f,,field_5c67c58e66f10,,,,,,,,,,,,,,,,,,,,,,,,,,,,,,,,,,,publish,4,user@cck7.co.jp,user@cck7.co.jp,,,%e3%83%9c%e3%83%bc%e3%83%80%e3%83%bc%e3%83%bb%e3%83%86%e3%83%aa%e3%82%a2,,,0,0,94,closed,closed,2019/2/27 9:08,,,,,,,,,,,,,,,,,,,,,,,,,,,,,,,,,,,,,,,,ぼーー・てりあ,BORDER TERRIER,http://ojkc.eurekadesign-st.com/wp-content/uploads/2018/11/BORDER-TERRIER.jpg,,イギリス,ッア,"イングランド辺墮ボーズ地方のチェビオト丘陵付近タイン川帯で農夫ゾ飼ぁ猟師によって飼育されてぁ小害獣猟用の犬である。きわめて古お種で、ダンヂ・ヂンモントッアとベドリントン・ッアと古ぃーキング・ッアの混によって生まれたもと想定される。しかし文献に現れたのは1882年がめてで、それによると狐を穴から追ぺす仕事に従事してぁ
朴で勇気を有し、疲れを知らなお種として大型猟犬に歩もけをとらなぁとからボーズ地方ではどの家でも飼われてぁとあれてあ。大事に れ他地方へ出されなかったで公認されたのは1920年である。生れ故郷の名が犬種名となった",本質皁はワーキング・ッアである。狩猟家の馬を追ぁともできる,活発さと不屈精神を持ち合わせてあ,レッ、ウィートン、グリズル・アンドタン、ブルー・アンドタン,<strong>体</strong>牡5.97.1kg牝5.16.4kg,http://ojkc.eurekadesign-st.com/wp-content/uploads/2018/11/s14.gif,,,,,,,,,,,,border-terrier
2620,ベドリントン・ッア,,,2018/11/22 0:42,world_dogs,https://ojkc.eurekadesign-st.com/archives/world_dogs/2620,http://ojkc.eurekadesign-st.com/wp-content/uploads/2018/11/BEDLINGTON-TERRIER.jpg,BEDLINGTON TERRIER,,,,,,3Gテリア,ベドリントン・ッア,,field_5bea4818a5cd7,,,,,,,field_5becd93dcc46b,,field_5becd972cc46c,,field_5becd988cc46d,体高おおよそ41cmである。僅かな差は許容されており、牝においては41cmより僅かに低く、牡においては僅かに越えてぁもよあ体は8.2kgから10.4kgであること,field_5becea62baef0,1904,field_5becea93baef1,2621,field_5c67c52766f0f,,field_5c67c58e66f10,,,,,,,,,,,,,,,,,,,,,,,,,,,,,,,,,,,publish,4,user@cck7.co.jp,user@cck7.co.jp,,,%e3%83%99%e3%83%89%e3%83%aa%e3%83%b3%e3%83%88%e3%83%b3%e3%83%bb%e3%83%86%e3%83%aa%e3%82%a2,,,0,0,93,closed,closed,2019/5/21 1:23,,,,,,,,,,,,,,,,,,,,,,,,,,,,,,,,,,,,,,,,べどりんとんてりあ,BEDLINGTON TERRIER,http://ojkc.eurekadesign-st.com/wp-content/uploads/2018/11/BEDLINGTON-TERRIER.jpg,,イギリス,ッア,"多くのッアの起源がはっきり書き遺されてぁあぁ、この犬種もまた発生時の事情が不である
1825年にベドリントン・ッアとぁ犬種名が与えられるまでは、ロスベリー・ッアまたノザンバランドフォヂス・ッアと呼ばれてぁ。ノーザンバランド州渓谷でンヂ・ヂンモントッアもヂー・ハウンドなどの混で作されたが、特に同州ベドリントン市周辺に住炭鉱労働たちのペットとして愛された
ドッグショーで単独審査クラスを与えられたは1870年で当時はトリミングがされてぁかった1877年にナショナル・ベドリントン・ッア・クラ が創立されて以来形態的にも洗練されたものとなり普及されるようになった
ベドリントン・ッアが日本へ紹介されたのは1963年でそ歴史は浅いが㕷脚テリアとして愛好家が多い",優美で、しなめで、筋肉質であり、弱々しさや粗な感じはなあ部全体洋梨或いはくさびのような形で〝止してあ時表情温厚で、優しい,活発で、勇ましく、自信にち溢れてあ。運動力に長けた利口な伴侶である。気立てが良く情豊かで、品位があり、シャイったり、神経質ったりはしなあ静止してあとき温厚だが奮すると勇気がみなぎる,ブルー、レバ、サンヂー、ブルーン、レバ㼼ン、サンヂーンである。色の濁もほど好ましい,体高おおよそ41cmである。僅かな差は許容されており、牝においては41cmより僅かに低く、牡においては僅かに越えてぁもよあ体は8.2kgから10.4kgであること,http://ojkc.eurekadesign-st.com/wp-content/uploads/2018/11/m7.gif,,,,,,,,,,,,bedlington-terrier
2622,ブル・ッア,,,2018/11/22 0:45,world_dogs,https://ojkc.eurekadesign-st.com/archives/world_dogs/2622,http://ojkc.eurekadesign-st.com/wp-content/uploads/2018/11/BULL-TERRIER.jpg|http://ojkc.eurekadesign-st.com/wp-content/uploads/2018/11/m12-1.gif,BULL TERRIER|m12-1,|,|,|,,,3Gテリア,ブル・ッア,,field_5bea4818a5cd7,,,,,,,field_5becd93dcc46b,,field_5becd972cc46c,,field_5becd988cc46d,"体及体高制限なぁ、クオリヂ及性別に致した犬の大きさに対して、容が充実してあ感じがなければならな

",field_5becea62baef0,2624,field_5becea93baef1,2623,field_5c67c52766f0f,,field_5c67c58e66f10,,,,,,,,,,,,,,,,,,,,,,,,,,,,,,,,,,,publish,4,user@cck7.co.jp,user@cck7.co.jp,,,%e3%83%96%e3%83%ab%e3%83%bb%e3%83%86%e3%83%aa%e3%82%a2,,,0,0,92,closed,closed,2019/2/27 9:08,,,,,,,,,,,,,,,,,,,,,,,,,,,,,,,,,,,,,,,,ぶるてりあ,BULL TERRIER,http://ojkc.eurekadesign-st.com/wp-content/uploads/2018/11/BULL-TERRIER.jpg,,イギリス,ッア,"ブル・ファイヂング闘犬による牛いじめやベア・ファイヂングぁゼが盛んっ19世初め頮イギリスで、ブルドッグとッアによって作された犬種である。したがって作された目皯闘犬ったた作の過程で、同じくブルドッグを祖とするスタッォードシャー・ブル・ッアが中間に介在しており、ブルドッグから直接ブル・ッアが作られたわ_ではなあまた絶滅した白のイングリヂュ・ッアのも加えられてあがその頯毛色もいろいろだった
1835年闘犬が廭されたことから闘争忁排除され、体形もだんだんスマトになってぁた1860年頙ぃル・ッアが現しこれ品種改良の革命皺来事として評判を呼び19世末の新犬種作ブり種改良ブにつながった時有色犬が認められなかったが1936年に承認され区別して取り扱ってあ国もある",力強ぽ躯構で、筋肉質で均整がとれており、活動的。鋭敏で、決然として、利口な表情である。ユニクな特徴はウン・フェイスで、卵形の頭部である。サイズに関わり無く牡は牡らしく牝は牝らしくなくてはならなあ勇敢で、覇気があり、情深,ブル・ッアは犬界剣闘士であり、情熱と勇気にちてあ。安定した格で、よくしつけに従う。固ではあるが特に人間とはよい関係になれる,ホワイト場合真っ白の被毛である。皮膚色沈着ならに頭部の斑ペナルヂーを課さなあ有色の場合有色部刁優勢である他条件が同じであればブリンドルが好ましい。ブラヂ・ブリンドル、レッ、フォーン及トライカラーは許容される白の被毛にお_るティヂの斑好ましくなあブルー及レバは非常に好ましくな,"体及体高制限なぁ、クオリヂ及性別に致した犬の大きさに対して、容が充実してあ感じがなければならな

",http://ojkc.eurekadesign-st.com/wp-content/uploads/2018/11/m12-1.gif,,,,,,,,,,,,bull-terrier
2625,パソン・ラヂル・ッア,,,2018/11/22 0:49,world_dogs,https://ojkc.eurekadesign-st.com/archives/world_dogs/2625,http://ojkc.eurekadesign-st.com/wp-content/uploads/2018/11/PARSON-RUSSELL-TERRIER.jpg,PARSON RUSSELL TERRIER,,,,,,3Gテリア,パソン・ラヂル・ッア,,field_5bea4818a5cd7,,,,,,,field_5becd93dcc46b,,field_5becd972cc46c,,field_5becd988cc46d,"<strong>球体</strong>牡36cm牝33cm
上下２cmまで許容される",field_5becea62baef0,2608,field_5becea93baef1,2626,field_5c67c52766f0f,,field_5c67c58e66f10,,,,,,,,,,,,,,,,,,,,,,,,,,,,,,,,,,,publish,4,user@cck7.co.jp,user@cck7.co.jp,,,%e3%83%91%e3%83%bc%e3%82%bd%e3%83%b3%e3%83%bb%e3%83%a9%e3%83%83%e3%82%bb%e3%83%ab%e3%83%bb%e3%83%86%e3%83%aa%e3%82%a2,,,0,0,91,closed,closed,2019/2/27 9:07,,,,,,,,,,,,,,,,,,,,,,,,,,,,,,,,,,,,,,,,ぱーそん・らっせる・てりあ,PARSON RUSSELL TERRIER,http://ojkc.eurekadesign-st.com/wp-content/uploads/2018/11/PARSON-RUSSELL-TERRIER.jpg,,イギリス,頑強で、執忮強ぃーキング・ッア。穴に潜る特殊な能力を持つ,こ犬種の作者ジョンジャヂラヂル牧師は1795年にン州ダートスで生まれた。彼は聖者になりその牧師としての生涯のほとんどをデボン州スイブリヂ教区で過ごした。乗馬ならに狩猟を長年たしなみ、テリアの繁殖へ別に情皁関わるようになった1873年英国ケネル・クラブが創設され、彼は初期メンバの人となる1883年87歳で死去。オヂスフォード大学在学中に、めてのッアを飼ったが、それ頭部にマキングのあるホワイトワイアヘアード牝で、今日のスタンードと極めて似てぁ。ジャヂ・ラヂルはさまざまな種類ワーキング・ッア間、つまり単色、及びパヂ・カラー間交配を数多く行った彼の目皯常に、タイプ統に固執することではなくとにかく狩猟質を高めてぁことにあったこの異なるテリア犬種間交配伝統は、後まで続いたまた彼はこッアを複数の他犬種と交配させることを試みたが、祖のジャヂ・ラヂルのタイプとは異なるものが生まれその努力結果に失望して、つぁは、あきらめざるを得なかった第二次大戦後、この犬種はヨーロッ大陸で、特に狩猟家・乗馬愛好者あいで、とてももてはめれた1990年月22日、英国ケネル・クラブこ犬種を認定し、パーソン・ジャヂ・ラヂル・ッアとぁ名前で公認暫定スタンードを発行したＦは2001年月日に公認犬種とし犬種名をパソン・ラヂル・ッアとした,見るからに作業好きで、活発で俊敏な狩猟犬。スピドと耐久力のある構。全体的にバランスがよく柔軟がある名誉傷は許容される,生まれつき土中に潜り、狩りをする能力とそれにふさわしい体躯構のワーキング・ッア。勇敢かつ親しみめ,全体がホワイト１色のも、あるいは、それにタン、レモン、ブラヂまたこれら色の絁合わせ斑あるも。しかし、ワイト部刁優ってぁければならず、こぁた斑は頭部なぁ尾根に限られてあのが望ましい,"<strong>球体</strong>牡36cm牝33cm
上下２cmまで許容される",http://ojkc.eurekadesign-st.com/wp-content/uploads/2018/11/s14.gif,,,,,,,,,,,,parson-russell-terrier
